[
  {
    "name": "java.util.HashMap",
    "allDeclaredConstructors": true, "allPublicConstructors": true, "allDeclaredMethods": true, "allPublicMethods": true, "allDeclaredFields": true, "allPublicFields": true
  },
  {
    "name": "java.util.RandomAccess",
    "allDeclaredConstructors": true, "allPublicConstructors": true, "allDeclaredMethods": true, "allPublicMethods": true, "allDeclaredFields": true, "allPublicFields": true
  },
  {
    "name": "java.util.ArrayList",
    "allDeclaredConstructors": true, "allPublicConstructors": true, "allDeclaredMethods": true, "allPublicMethods": true, "allDeclaredFields": true, "allPublicFields": true
  },
  {
    "name": "java.util.Arrays$ArrayList",
    "allDeclaredConstructors": true, "allPublicConstructors": true, "allDeclaredMethods": true, "allPublicMethods": true, "allDeclaredFields": true, "allPublicFields": true
  },
  {
    "name": "java.util.AbstractList",
    "allDeclaredMethods": true, "allPublicMethods": true, "allDeclaredFields": true, "allPublicFields": true
  },
  {
    "name": "java.util.Iterator",
    "allDeclaredConstructors": true, "allPublicConstructors": true, "allDeclaredMethods": true, "allPublicMethods": true, "allDeclaredFields": true, "allPublicFields": true
  },
  {
    "name": "java.util.Collections$EmptyIterator",
    "allDeclaredConstructors": true, "allPublicConstructors": true, "allDeclaredMethods": true, "allPublicMethods": true, "allDeclaredFields": true, "allPublicFields": true
  },
  {
    "name": "java.io.Serializable",
    "allDeclaredConstructors": true, "allPublicConstructors": true, "allDeclaredMethods": true, "allPublicMethods": true, "allDeclaredFields": true, "allPublicFields": true
  },
  {
    "name": "java.lang.Object",
    "allDeclaredConstructors": true, "allPublicConstructors": true, "allDeclaredMethods": true, "allPublicMethods": true, "allDeclaredFields": true, "allPublicFields": true
  },
  {
    "name": "java.lang.String",
    "allDeclaredConstructors": true, "allPublicConstructors": true, "allDeclaredMethods": true, "allPublicMethods": true, "allDeclaredFields": true, "allPublicFields": true
  },
  {
    "name": "java.util.function.Function",
    "allDeclaredConstructors": true, "allPublicConstructors": true, "allDeclaredMethods": true, "allPublicMethods": true, "allDeclaredFields": true, "allPublicFields": true
  },
  {
    "name": "java.util.function.Supplier",
    "allDeclaredConstructors": true, "allPublicConstructors": true, "allDeclaredMethods": true, "allPublicMethods": true, "allDeclaredFields": true, "allPublicFields": true
  },
  {
    "name": "java.math.BigInteger",
    "allDeclaredConstructors": true, "allPublicConstructors": true, "allDeclaredMethods": true, "allPublicMethods": true, "allDeclaredFields": true, "allPublicFields": true
  },
  {
    "name": "java.lang.reflect.Field",
    "methods": [
      { "name": "get", "parameterTypes": ["java.lang.Object"] }
    ]
  },
  {
    "name": "java.lang.Class",
    "methods": [
      { "name": "getName", "parameterTypes": [] },
      { "name": "isInstance", "parameterTypes": ["java.lang.Object"] }
    ]
  }
]
